<?xml version="1.0" encoding="UTF-8"?>
<dataroot xmlns:od="urn:schemas-microsoft-com:officedata" xmlns:xsi="http://www.w3.org/2001/XMLSchema-instance"  xsi:noNamespaceSchemaLocation="directory.xsd" generated="2013-04-04T21:54:21">
<directory>
<people_ID>1</people_ID>
<families_ID>2</families_ID>
<family_name>King</family_name>
<last_name>King</last_name>
<first_name>Cameron</first_name>
<person_type_name>Member</person_type_name>
<relationship_type_name>Head</relationship_type_name>
<sort>100</sort>
<address_1>1300 Raines St</address_1>
<city>Arlington</city>
<state>TX</state>
<zipcode>76010</zipcode>
<country>USA</country>
<people_phone>(682) 999-0991</people_phone>
<people_email>cking@ckxng.com</people_email>
<birthday>1986-07-14T00:00:00</birthday>
<anniversary>2005-12-31T00:00:00</anniversary>
</directory>
<directory>
<people_ID>2</people_ID>
<families_ID>2</families_ID>
<family_name>King</family_name>
<last_name>King</last_name>
<first_name>Megan</first_name>
<person_type_name>Member</person_type_name>
<relationship_type_name>Spouse</relationship_type_name>
<sort>200</sort>
<address_1>1300 Raines St</address_1>
<city>Arlington</city>
<state>TX</state>
<zipcode>76010</zipcode>
<country>USA</country>
<people_phone>(682) 999-0981</people_phone>
<people_email>megan@uniquekings.com</people_email>
<birthday>1981-09-02T00:00:00</birthday>
<anniversary>2005-12-31T00:00:00</anniversary>
</directory>
<directory>
<people_ID>4</people_ID>
<families_ID>2</families_ID>
<family_name>King</family_name>
<last_name>King</last_name>
<first_name>Mason</first_name>
<person_type_name>Child</person_type_name>
<relationship_type_name>Child</relationship_type_name>
<sort>700</sort>
<address_1>1300 Raines St</address_1>
<city>Arlington</city>
<state>TX</state>
<zipcode>76010</zipcode>
<country>USA</country>
<birthday>2012-04-20T00:00:00</birthday>
</directory>
<directory>
<people_ID>3</people_ID>
<families_ID>2</families_ID>
<family_name>King</family_name>
<last_name>King</last_name>
<first_name>Brooklyn</first_name>
<person_type_name>Child</person_type_name>
<relationship_type_name>Child</relationship_type_name>
<sort>700</sort>
<address_1>1300 Raines St</address_1>
<city>Arlington</city>
<state>TX</state>
<zipcode>76010</zipcode>
<country>USA</country>
<birthday>2009-07-10T00:00:00</birthday>
</directory>
</dataroot>
